{"champion":"Kindred","elo":"master_plus","games":2,"items":[{"ci":null,"flags":["low_overlap"],"item":3078,"n":2,"picks":2,"slot":1,"wpa":null},{"ci":null,"flags":["low_overlap"],"item":2523,"n":1,"picks":1,"slot":2,"wpa":null},{"ci":null,"flags":["low_overlap"],"item":6676,"n":1,"picks":1,"slot":2,"wpa":null},{"ci":null,"flags":["low_overlap"],"item":3036,"n":1,"picks":1,"slot":3,"wpa":null}],"lateSlot":4,"patch":"16.20","region":"all","role":"JUNGLE","runeChoices":[{"ci":null,"flags":["low_overlap"],"games":2,"kind":"shard","n":2,"perks":[5005],"row":1,"wpa":null},{"ci":null,"flags":["low_overlap"],"games":2,"kind":"shard","n":2,"perks":[5008],"row":2,"wpa":null},{"ci":null,"flags":["low_overlap"],"games":1,"kind":"shard","n":1,"perks":[5001],"row":3,"wpa":null},{"ci":null,"flags":["low_overlap"],"games":1,"kind":"shard","n":1,"perks":[5011],"row":3,"wpa":null},{"ci":null,"flags":["low_overlap"],"games":2,"kind":"primary","n":2,"perks":[9111],"row":1,"style":8000,"wpa":null},{"ci":null,"flags":["low_overlap"],"games":2,"kind":"primary","n":2,"perks":[9104],"row":2,"style":8000,"wpa":null},{"ci":null,"flags":["low_overlap"],"games":1,"kind":"primary","n":1,"perks":[8017],"row":3,"style":8000,"wpa":null},{"ci":null,"flags":["low_overlap"],"games":1,"kind":"primary","n":1,"perks":[8299],"row":3,"style":8000,"wpa":null},{"ci":null,"flags":["low_overlap"],"games":1,"kind":"secondary","n":1,"perks":[8135,8143],"style":8100,"wpa":null},{"ci":null,"flags":["low_overlap"],"games":1,"kind":"secondary","n":1,"perks":[8304,8347],"style":8300,"wpa":null}],"runes":[{"ci":null,"flags":["low_overlap"],"games":1,"n":1,"page":{"perks":[8005,9111,9104,8017,8304,8347,5005,5008,5001],"primaryStyle":8000,"subStyle":8300},"wpa":null},{"ci":null,"flags":["low_overlap"],"games":1,"n":1,"page":{"perks":[8010,9111,9104,8299,8143,8135,5005,5008,5011],"primaryStyle":8000,"subStyle":8100},"wpa":null}],"schemaVersion":1,"spells":[{"ci":null,"flags":[],"games":2,"n":2,"spells":[4,11],"wpa":null}]}
