{"champion":"Zed","elo":"master_plus","games":1,"items":[{"ci":null,"flags":["low_overlap"],"item":6699,"n":1,"picks":1,"slot":1,"wpa":null},{"ci":null,"flags":["low_overlap"],"item":2520,"n":1,"picks":1,"slot":2,"wpa":null},{"ci":null,"flags":["low_overlap"],"item":6694,"n":1,"picks":1,"slot":3,"wpa":null},{"ci":null,"flags":["low_overlap"],"item":2517,"n":1,"picks":1,"slot":4,"wpa":null}],"patch":"16.20","region":"all","role":"MIDDLE","runes":[{"ci":null,"flags":["low_overlap"],"games":1,"n":1,"page":{"perks":[8112,8143,8140,8106,8210,8237,5008,5008,5011],"primaryStyle":8100,"subStyle":8200},"wpa":null}],"schemaVersion":1,"spells":[{"ci":null,"flags":[],"games":1,"n":1,"spells":[14,4],"wpa":null}]}
