{"champion":"Leona","elo":"master_plus","games":1,"items":[{"ci":null,"flags":["low_overlap"],"item":2525,"n":1,"slot":1,"wpa":null},{"ci":null,"flags":["low_overlap"],"item":3190,"n":1,"slot":2,"wpa":null},{"ci":null,"flags":["low_overlap"],"item":8020,"n":1,"slot":3,"wpa":null}],"patch":"16.20","region":"all","role":"UTILITY","runes":[{"ci":null,"flags":["low_overlap"],"n":1,"page":{"perks":[8439,8463,8473,8242,8347,8304,5007,5010,5011],"primaryStyle":8400,"subStyle":8300},"wpa":null}],"schemaVersion":1,"spells":[]}
