{"boots":[{"ci":null,"flags":["low_overlap"],"games":1,"item":3008,"n":1,"wpa":null},{"against":"physical","ci":null,"flags":["low_overlap"],"games":1,"item":3008,"n":1,"wpa":null}],"champion":"Kaisa","elo":"master_plus","firstComponents":[{"buy":[1001,1043],"ci":null,"flags":["low_overlap"],"games":1,"items":[1043],"n":1,"wpa":null}],"games":1,"items":[{"ci":null,"flags":["low_overlap"],"item":6672,"n":1,"picks":1,"slot":1,"wpa":null},{"ci":null,"flags":["low_overlap"],"item":3124,"n":1,"picks":1,"slot":2,"wpa":null},{"ci":null,"flags":["low_overlap"],"item":3046,"n":1,"picks":1,"slot":3,"wpa":null},{"ci":null,"flags":["low_overlap"],"item":3031,"n":1,"picks":1,"slot":4,"wpa":null}],"lateSlot":4,"patch":"16.20","region":"all","role":"BOTTOM","runeChoices":[{"ci":null,"flags":["low_overlap"],"games":1,"kind":"shard","n":1,"perks":[5005],"row":1,"wpa":null},{"ci":null,"flags":["low_overlap"],"games":1,"kind":"shard","n":1,"perks":[5008],"row":2,"wpa":null},{"ci":null,"flags":["low_overlap"],"games":1,"kind":"shard","n":1,"perks":[5011],"row":3,"wpa":null},{"ci":null,"flags":["low_overlap"],"games":1,"kind":"primary","n":1,"perks":[9111],"row":1,"style":8000,"wpa":null},{"ci":null,"flags":["low_overlap"],"games":1,"kind":"primary","n":1,"perks":[9104],"row":2,"style":8000,"wpa":null},{"ci":null,"flags":["low_overlap"],"games":1,"kind":"primary","n":1,"perks":[8017],"row":3,"style":8000,"wpa":null},{"ci":null,"flags":["low_overlap"],"games":1,"kind":"secondary","n":1,"perks":[8313,8321],"style":8300,"wpa":null}],"runes":[{"ci":null,"flags":["low_overlap"],"games":1,"n":1,"page":{"perks":[8008,9111,9104,8017,8321,8313,5005,5008,5011],"primaryStyle":8000,"subStyle":8300},"wpa":null}],"schemaVersion":1,"spells":[{"ci":null,"flags":[],"games":1,"n":1,"spells":[4,21],"wpa":null}],"starts":[{"buy":[1086,2003,2003,3340],"ci":null,"flags":["low_overlap"],"games":1,"items":[1086],"n":1,"wpa":null}]}
