{"champion":"Zilean","elo":"master_plus","games":1,"items":[{"ci":null,"flags":["low_overlap"],"item":3003,"n":1,"slot":1,"wpa":null}],"patch":"16.20","region":"all","role":"MIDDLE","runes":[{"ci":null,"flags":["low_overlap"],"n":1,"page":{"perks":[8214,8226,8210,8237,8009,9105,5007,5008,5001],"primaryStyle":8200,"subStyle":8000},"wpa":null}],"schemaVersion":1,"spells":[]}
