{"boots":[{"ci":null,"flags":["low_overlap"],"games":1,"item":3009,"n":1,"wpa":null},{"ci":null,"flags":["low_overlap"],"games":1,"item":3047,"n":1,"wpa":null},{"against":"mixed","ci":null,"flags":["low_overlap"],"games":1,"item":3047,"n":1,"wpa":null},{"against":"magic","ci":null,"flags":["low_overlap"],"games":1,"item":3009,"n":1,"wpa":null}],"champion":"Senna","elo":"master_plus","firstComponents":[{"buy":[1028,1036,2022],"ci":null,"flags":["low_overlap"],"games":1,"items":[1028,1036,2022],"n":1,"wpa":null}],"games":2,"items":[{"ci":null,"flags":["low_overlap"],"item":3071,"n":2,"picks":2,"slot":1,"wpa":null},{"ci":null,"flags":["low_overlap"],"item":3087,"n":2,"picks":2,"slot":2,"wpa":null},{"ci":null,"flags":["low_overlap"],"item":2523,"n":1,"picks":1,"slot":3,"wpa":null},{"ci":null,"flags":["low_overlap"],"item":6695,"n":1,"picks":1,"slot":3,"wpa":null}],"lateSlot":4,"patch":"16.20","region":"all","role":"UTILITY","runeChoices":[{"ci":null,"flags":["low_overlap"],"games":1,"kind":"shard","n":1,"perks":[5005],"row":1,"wpa":null},{"ci":null,"flags":["low_overlap"],"games":1,"kind":"shard","n":1,"perks":[5008],"row":1,"wpa":null},{"ci":null,"flags":["low_overlap"],"games":1,"kind":"shard","n":1,"perks":[5008],"row":2,"wpa":null},{"ci":null,"flags":["low_overlap"],"games":1,"kind":"shard","n":1,"perks":[5010],"row":2,"wpa":null},{"ci":null,"flags":["low_overlap"],"games":2,"kind":"shard","n":2,"perks":[5011],"row":3,"wpa":null},{"ci":null,"flags":["low_overlap"],"games":1,"kind":"primary","n":1,"perks":[8226],"row":1,"style":8200,"wpa":null},{"ci":null,"flags":["low_overlap"],"games":1,"kind":"primary","n":1,"perks":[8275],"row":1,"style":8200,"wpa":null},{"ci":null,"flags":["low_overlap"],"games":2,"kind":"primary","n":2,"perks":[8234],"row":2,"style":8200,"wpa":null},{"ci":null,"flags":["low_overlap"],"games":1,"kind":"primary","n":1,"perks":[8236],"row":3,"style":8200,"wpa":null},{"ci":null,"flags":["low_overlap"],"games":1,"kind":"primary","n":1,"perks":[8237],"row":3,"style":8200,"wpa":null},{"ci":null,"flags":["low_overlap"],"games":2,"kind":"secondary","n":2,"perks":[8304,8316],"style":8300,"wpa":null}],"runes":[{"ci":null,"flags":["low_overlap"],"games":1,"n":2,"page":{"perks":[8992,8226,8234,8236,8316,8304,5005,5008,5011],"primaryStyle":8200,"subStyle":8300},"wpa":null}],"schemaVersion":1,"spells":[{"ci":null,"flags":[],"games":2,"n":2,"spells":[4,7],"wpa":null}],"starts":[]}
